Title,Genre,Actor,Director,Musician,Photography,Producer,Writer,"Release Year",Studio,"Release Date",Language,Country,Color,Runtime,Region,"IMDb Url",Plot,"IMDb Rating","Audience Rating"
Haze,"Horror, Mystery","Shin'ya Tsukamoto, Takahiro Murase, Takahiro Kandaka","Shin'ya Tsukamoto","Chu Ishikawa","Shin'ya Tsukamoto","Shin'ichi Kawahara, Shin'ya Tsukamoto","Shin'ya Tsukamoto",2005,"Gold View Company",2005,Japanese,Japan,Color,49,,https://www.imdb.com/title/tt0491399/?ref_=ref_ext_clz,"A man awakes to find himself trapped in a dirty, confined crawlspace. He barely has enough room to move. He also has no memory of why he’s there, or why he’s bleeding from a stomach wound. Apparently drugged, he occasionally ‘zones out’ of his surroundings as he tries to edge towards his way to freedom. But the more he explores, the more pain he has to endure, and the more frightening his predicament becomes.",6.6,
"The Hearse","Drama, Horror, Thriller","Trish Van Devere, Joseph Cotten, David Gautreaux","George Bowers","Webster Lewis","Mori Kawa","Newton P. Jacobs, Chuck Russell, Mark Tenser","William Bleich, Mark Tenser",1980,"Crown International Pictures",1980,English,USA,Color,99,"Region A, Region B, Region C",https://www.imdb.com/title/tt0080853/?ref_=ref_ext_clz,"A schoolteacher moves into her deceased aunt’s house in a small Californian town, and is harassed by unfriendly locals and a mysterious hearse.",4.9,"US - PG"
"The House by the Cemetery",Horror,"Catriona MacColl, Paolo Malco, Ania Pieroni","Lucio Fulci","Walter Rizzati","Sergio Salvati","Fabrizio De Angelis","Elisa Briganti, Dardano Sacchetti, Giorgio Mariuzzo",1981,"Fulvia Film",1981,Italian,Italy,Color,86,,https://www.imdb.com/title/tt0082966/?ref_=ref_ext_clz,"After a doctor kills his mistress and himself while researching the mysterious previous owner of his Boston home, his colleague, Dr. Norman Boyle, takes over his research and moves his family from New York City to the Boston mansion. Soon after, Boyle's young son Bob becomes plagued by visions of a young girl, who warns him of the danger within the house.",6.2,
"The House of Usher",Horror,"Oliver Reed, Donald Pleasence, Romy Windsor","Alan Birkinshaw","Gary Chang, George S. Clinton","Yossi Wein","Avi Lerner, John Stodel, Harry Alan Towers","Michael J. Murray, Edgar Allan Poe",1989,"21st Century Film Corporation",1989,English,USA,Color,92,,https://www.imdb.com/title/tt0095332/?ref_=ref_ext_clz,"An updated version of the classic horror tale by Edgar Allen Poe. Ryan and his girlfriend Molly are going to visit Ryan's uncle, Roderick Usher, at his mansion. They find, however, that Roderick's brother Walter has gone insane, and Roderick himself isn't far behind. Can Ryan and Molly escape from the doomed mansion before the curse of Usher claims them as well?",4.5,"US - R"
"In the Mouth of Madness","Drama, Horror, Mystery, Thriller","Sam Neill, Julie Carmen, Jürgen Prochnow","John Carpenter","John Carpenter, Jim Lang","Gary B. Kibbe","Michael De Luca, Sandy King, Artist W. Robinson","Michael De Luca",1995,"New Line Cinema",1995,English,USA,Color,95,"Region A",https://www.imdb.com/title/tt0113409/?ref_=ref_ext_clz,"An insurance investigator begins discovering that the impact a horror writer's books have on his fans is more than inspirational.",7.2,"US - R"
"Katie Tippel",Drama,"Monique van de Ven, Rutger Hauer, Andrea Domburg","Paul Verhoeven","Rogier van OTTERLOO","Jan de Bont","Rob Houwer","Gerard Soeteman, Neel Doff",1975,"Rob Houwer Productions",1975,Dutch,"The Netherlands",Color,100,,https://www.imdb.com/title/tt0073233/?ref_=ref_ext_clz,"In the late 19th century, a young woman moves to Amsterdam with her family and tries to make a living. Preyed upon by various men, she nonetheless rises in society.",6.6,"US - R"
Killing,"Action, Drama","Shin'ya Tsukamoto, Yû Aoi, Sosuke Ikematsu","Shin'ya Tsukamoto",,"Satoshi Hayashi, Shin'ya Tsukamoto","Shin'ya Tsukamoto","Shin'ya Tsukamoto",2018,"Shin Nippon Films",2018,Japanese,Japan,Color,80,,https://www.imdb.com/title/tt7117352/?ref_=ref_ext_clz,"In Edo period Japan, a lone ronin spends time in a village helping the farmers tend to their land. To keep his sword skills sharp, he spars daily with a farmer's son. Meanwhile, the nation is in the midst of major unrest with civil war on the horizon. One day, a group of outlaw ronin enters the village.",6.4,
Kotoko,"Drama, Horror","Shin'ya Tsukamoto, Yuko Nakamura, Cocco","Shin'ya Tsukamoto",Cocco,"Satoshi Hayashi, Shin'ya Tsukamoto","Cocco, Kiyo Joo, Keiko Kusakabe","Cocco, Shin'ya Tsukamoto",2011,"Kaijyu Theater",2011,Japanese,Japan,Color,91,,https://www.imdb.com/title/tt1842532/?ref_=ref_ext_clz,"A single mother (Cocco) becomes afflicted with double vision. Taking care of her newborn baby becomes a nightmare as the mother also becomes paranoid. The only time the mother doesn't see double is when she sings. She also finds solace in cutting herself, allowing her blood to drip free and able to feel alive. A terrifying nervous breakdown ensues. When things spiral out of control, her baby is taken away. She then rides a bus and sings to herself. A man (Shinya Tsukamoto) sitting nearby listens to her wonderful voice. He begins to stalk her. The man is an award winning novelist who has fallen in love with the woman. They begin a volatile relationship. The woman's paranoia a",6.7,
"Malibu High","Crime, Drama, Thriller","Jill Lansing, Stuart Taylor, Katie Johnson","Irvin Berwick",,"William De Diego","Lawrence D. Foldes, Craig Muckler, Thomas Singer","John Buckley, Thomas Singer",1979,"Star Cinema Productions",1979,English,USA,Color,90,"Region A, Region B, Region C, Region Free",https://www.imdb.com/title/tt0079514/?ref_=ref_ext_clz,"When a high school senior is dumped by her boyfriend, her grades fall drastically...to avoid failing, she begins seducing her male teachers. Thus begins her downward spiral into drug addiction and prostitution, and ultimately assassinations for a kingpin mob boss.",5,"US - R"
"La mansión de los Cthulhu",Horror,"Frank Finlay, Marcia Layton, Luis Fernando Alvés","J.P. Simon","Tim Souster","Julio Bragado","Bob Baker, Roger Crago, José Gutiérrez Maesso","J.P. Simon, H.P. Lovecraft, Linda Moore",1992,"Dister Group",1992,English,Spain,Color,95,"Region Free",https://www.imdb.com/title/tt0100108/?ref_=ref_ext_clz,"An aging magician harboring a terrible occult secret and his daughter are taken hostage in their isolated mansion by teenage scumbags needing a place to hide out. When the captors refuse to listen to the magician's dire warning to release him unharmed, the mansion slowly releases its nightmare of horrors on the unsuspecting invaders.",3.5,"US - R"
"Martial Law","Action, Crime","Chad McQueen, Cynthia Rothrock, David Carradine","Steve Cohen","Elliot Solomon","John Huneck","Kurt Anderson, Richard Brandes, Pierre David","Richard Brandes",1990,"Ascot Video",1990,English,USA,Color,89,,https://www.imdb.com/title/tt0104822/?ref_=ref_ext_clz,"An undercover cop teams up with a martial-arts expert to stop a gang of drug smugglers and car thieves.",4.8,"US - R"
"Martial Law II: Undercover","Action, Crime","Jeff Wincott, Cynthia Rothrock, Paul Johansson","Kurt Anderson","Elliot Solomon","Peter Fernberger","Steve Cohen, Pierre David, Robert W. Mann","Richard Brandes, Pierre David, Jiles Fitzgerald",1991,"Ascot Video",1991,English,USA,Color,91,,https://www.imdb.com/title/tt0104823/?ref_=ref_ext_clz,"Sean and Billie are undercover cops and martial arts masters. Investigating the death of a cop, they uncover a deadly ring of murder and corruption at a glitzy nightclub where the rich are entertained by seductive women and protected by martial arts experts. Billie goes undercover to infiltrate the crime ring, leading to an explosive finale.",5.2,"US - R"
"My Lucky Stars","Action, Comedy, Crime","Sammo Hung Kam-Bo, Charlie Chin, Shui-Fan Fung","Sammo Hung Kam-Bo","Siu-Tin Lai, Siu-Lam Tang","Arthur Wong","Leonard Ho, Sammo Hung Kam-Bo","Barry Wong, Cheuk-Hon Szeto, Kin Lo",1985,"Filmes Castello Lopes",1985,Cantonese,"Hong Kong",Color,96,,https://www.imdb.com/title/tt0089177/?ref_=ref_ext_clz,"Two Hong-Kong cops are sent to Tokyo to catch an ex-cop who stole a large amount of money in diamonds. After one is captured by the Ninja-gang protecting the rogue cop, the other one gets his old Orphanage gang, dubbed the ""Five Lucky Stars,"" to help him. They don't like this much, but they do it.",6.5,"US - PG-13"
"Nightmare Weekend","Horror, Science Fiction","Debbie Laster, Dale Midkiff, Debra Hunter","Henri Sala","Martin Kershaw","Robert M. Baldwin, Denis Gheerbrant","Andre Feingold, Gerald Gottlieb, Bachoo Sen","George Faget-Benard, Robert Seidman",1986,,1986,English,UK,Color,85,,https://www.imdb.com/title/tt0091631/?ref_=ref_ext_clz,"A female scientist performs experiments on three college girls that turn them into drooling, murderous mutants.",3.1,"US - R"
"Pan's Labyrinth","Drama, Fantasy, War","Ivana Baquero, Sergi Lopez, Maribel Verdú","Guillermo del Toro","Javier Navarrete","Guillermo Navarro","Víctor Albarrán, Belén Atienza, Alvaro Augustin","Guillermo del Toro",2006,CDE,2006,Spanish,Mexico,Color,118,,https://www.imdb.com/title/tt0457430/?ref_=ref_ext_clz,"Living with her tyrannical stepfather in a new home with her pregnant mother, 10-year-old Ofelia feels alone until she explores a decaying labyrinth guarded by a mysterious faun who claims to know her destiny. If she wishes to return to her real father, Ofelia must complete three terrifying tasks.",8.2,"US - R"
"Perfect Strangers","Crime, Drama, Thriller","Anne Carlisle, Brad Rijn, John Woehrle","Larry Cohen","Dwight Dixon","Paul Glickman","Carter DeHaven, Richard M. Greenberg, Paul Kurta","Larry Cohen",1984,"Cinema '84/Greenberg Brothers Partnership",1984,English,USA,Color,91,,https://www.imdb.com/title/tt0087901/?ref_=ref_ext_clz,"A hit-man tries to seduce the mother of a child who witnessed his most recent kill.",5.5,"US - R"
"The Pervert's Guide to Cinema",Documentary,"Slavoj Zizek","Sophie Fiennes","Brian Eno","Remko Schnorr","Sophie Fiennes, Ineke Kanters, Georg Misch","Slavoj Zizek",2006,"Amoeba Films",2006,English,UK,Color,150,,https://www.imdb.com/title/tt0828154/?ref_=ref_ext_clz,"The Pervert's Guide to Cinema offers an introduction into some of Žižek's most exciting ideas on fantasy, reality, sexuality, subjectivity, desire, materiality and cinematic form. Whether he is untangling the famously baffling films of David Lynch, or overturning everything you thought you knew about Hitchcock, Žižek illuminates the screen with his passion, intellect, and unfailing sense of humour.",7.8,
"The Pervert's Guide to Ideology",Documentary,"Slavoj Zizek","Sophie Fiennes",,,,,2013,Zeitgeist,2013,English,UK,Color,134,,,"Philosopher Slavoj Žižek and filmmaker Sophie Fiennes reunites for this follow-up to their hit The Pervert's Guide to Cinema, using their interpretation of moving pictures to present a compelling cinematic journey into the heart of ideology – the dreams that shape our collective beliefs and practices.",,
Pieces,"Horror, Mystery, Thriller","Christopher George, Lynda Day George, Frank Braña","J.P. Simon","Silvano Chimenti, Stelvio Cipriani, Carlo Maria Cordio","Juan MARINÉ","Stephen Minasian, Dick Randall, Edward L. Montoro","Dick Randall, Roberto Loyola, J.P. Simon",1982,"Almena Films",1982,Spanish,Spain,Color,85,"Region A, Region B, Region C",https://www.imdb.com/title/tt0082748/?ref_=ref_ext_clz,"A frustrated Boston detective searches for the maniac responsible for mutilating a number of university coeds.",6.1,
"Project A","Action, Comedy","Jackie Chan, Sammo Hung Kam-Bo, Biao Yuen","Jackie Chan, Sammo Hung Kam-Bo","Siu-Tin Lai, Nicholas Rivera","Yiu-Tsou Cheung","Raymond Chow, Leonard Ho, Edward Tang","Jackie Chan, Jack Maeby, Edward Tang",1983,"First Films",1983,Cantonese,"Hong Kong",Color,105,,https://www.imdb.com/title/tt0085127/?ref_=ref_ext_clz,"In late 19th Century Hong Kong the British may rule the land, but the pirates rule the waters. One Coast Guard officer is Dragon Ma, who is determined that his beloved Coast Guard will not be made a fool of.",7.4,"US - PG-13"
"Project A 2","Action, Comedy, Crime","Jackie Chan, Maggie Cheung, Rosamund Kwan","Jackie Chan","Siu-Tin Lai","Yiu-Tsou Cheung","Raymond Chow, Leonard Ho, David Lam","Jackie Chan, Jack Maeby, Edward Tang",1987,"Golden Way Films Ltd.",1987,English,"Hong Kong",Color,101,,https://www.imdb.com/title/tt0092501/?ref_=ref_ext_clz,"Dragon is now transferred to be the police head of Sai Wan district, and has to contend with a gangster kingpin, anti-Manchu revolutionaries, some runaway pirates, Manchu Loyalists and a corrupt police superintendent.",7.1,"US - PG-13"
Rabid,"Horror, Science Fiction","Marilyn Chambers, Frank Moore, Joe Silver","David Cronenberg",,"René Verzier","Don Carmody, John Dunning, Danny Goldberg","David Cronenberg",1977,"Cinépix Film Properties (CFP)",1977,English,Canada,Color,91,"Region A",https://www.imdb.com/title/tt0076590/?ref_=ref_ext_clz,"After undergoing radical surgery for injuries from a motorcycle accident, a young woman develops a strange phallic growth on her body and a thirst for human blood—the only nourishment that will now sustain her.",6.3,"US - R"
Re-Animator,"Comedy, Horror, Science Fiction","Jeffrey Combs, Bruce Abbott, Barbara Crampton","Stuart Gordon","Richard Band","Mac Ahlberg","Michael Avery, Bruce William Curtis, Bob Greenberg","H.P. Lovecraft, Dennis Paoli, William Norris",1985,"Empire Pictures",1985,English,USA,Color,105,"Region 1",https://www.imdb.com/title/tt0089885/?ref_=ref_ext_clz,"A dedicated student at a medical college and his girlfriend become involved in bizarre experiments centering around the re-animation of dead tissue when an odd new student arrives on campus.",7.2,
"Return of the Street Fighter","Action, Crime, Drama","Sonny Chiba, Yôko Ichiji, Masashi Ishibashi","Shigehiro Ozawa","Toshiaki Tsushima","Sadaji Yoshida","Norimichi Matsudaira","Shigehiro Ozawa, Kôji Takada, Hajime Takaiwa",1974,"Toei Company",1974,Japanese,Japan,Color,88,,https://www.imdb.com/title/tt0073623/?ref_=ref_ext_clz,"Martial artist Takuma Tsurugi returns to take on a Yakuza family that may be embezzling money from charities to finance their own operations. Both the police and the Yakuza find themselves battling Tsurugi, but Tsurugi's fight ultimately is with the mob, and he concentrates on them.",6.4,"US - R"
"Road to Revenge","Action, Drama","John De Hart, Wings Hauser, William Smith","John De Hart, James Paradise",,"Eric J. Swanson","John De Hart, Rebecca Warren, Jimmy Williams","John De Hart",1993,"Monarch Productions (III)",1993,English,USA,Color,89,"Region Free",https://www.imdb.com/title/tt0169183/?ref_=ref_ext_clz,"The Corruption of The System is given a swift lopsided kick by Vigilante Justice as a Disgraced Former Cop emerges from exile, automatic weapons blazing and mediocre martial arts akimbo, to bring down a murderous satanic cult headed by his former partner. His only allies? A boatload of swagger and one leggy blonde.",4.3,
RoboCop,"Action, Crime, Science Fiction, Thriller","Peter Weller, Nancy Allen, Dan O'Herlihy","Paul Verhoeven","Basil Poledouris","Jost Vacano, Sol Negrin","Jon Davison, Stephen Lim, Edward Neumeier","Edward Neumeier, Michael Miner",1987,"Orion Pictures",1987,English,USA,Color,102,,https://www.imdb.com/title/tt0093870/?ref_=ref_ext_clz,"In a violent, near-apocalyptic Detroit, evil corporation Omni Consumer Products wins a contract from the city government to privatize the police force. To test their crime-eradicating cyborgs, the company leads street cop Alex Murphy into an armed confrontation with crime lord Boddicker so they can use his body to support their untested RoboCop prototype. But when RoboCop learns of the company's nefarious plans, he turns on his masters.",7.6,"US - R"
"Santa Sangre","Drama, Horror, Thriller","Axel Jodorowsky, Blanca Guerra, Guy Stockwell","Alejandro Jodorowsky","Simon Boswell","Daniele Nannuzzi","Claudio Argento, Anuar Badin, Lars Bloch","Alejandro Jodorowsky, Roberto Leoni, Claudio Argento",1989,"Productora Fílmica Real",1989,English,Mexico,Color,123,,https://www.imdb.com/title/tt0098253/?ref_=ref_ext_clz,"A young man is confined in a mental hospital. Through a flashback we see that he was traumatized as a child, when he and his family were circus performers: he saw his father cut off the arms of his mother, a religious fanatic and leader of the heretical church of Santa Sangre (""Holy Blood""), and then commit suicide. Back in the present, he escapes and rejoins his surviving and armless mother.",7.6,"US - R"
"Satan's Blood",Horror,"Angel Aranda, Sandra Alberti, Mariana Karr","Carlos Puerto, J.P. Simon","Librado Pastor","Andrés Berenguer","Francisco Ariza, Alfredo Casado, J.P. Simon","Carlos Puerto",1978,"Juan Piquer Simón",1978,English,Spain,Color,82,"Region Free",https://www.imdb.com/title/tt0075999/?ref_=ref_ext_clz,"Andy and Thelma, an urbanite couple living in Madrid, leave their apartment for a pleasant day around the city with their dog. They cross paths with Bruno and Anne, a strange couple who invite them to their foreboding country estate. A storm hits that evening and the two stay overnight. The couples engage in a bit of harmless communication with spirits via ouija board, but soon past conflicts arise Thelma had an affair with Andy's brother, and Anne criticizes Bruno over his attempted suicide. This is only the beginning of all the horrors that will haunt them in the house.",6,
"Scanner Cop","Horror, Science Fiction","Daniel Quinn, Darlanne Fluegel, Richard Grove","Pierre David","Louis Febre","Jacques Haitkin","Pierre David, Rene Malo, Robert Lansing Parker","John Bryant, David Cronenberg, Pierre David",1994,"Image Organization",1994,English,Canada,Color,95,,https://www.imdb.com/title/tt0111082/?ref_=ref_ext_clz,"Sam Staziak, a rookie cop with the Los Angeles Police Department, is also a 'scanner' (psionic). When a string of murders begins to decimate the police department, Sam faces sensory overload and possible insanity as he uses his powers to hunt the man responsible for the killings.",5.3,"US - R"
"Scanner Cop 2","Horror, Science Fiction","Daniel Quinn, Patrick Kilpatrick, Khrystyne Haje","Steve Barnett, Christian Duguay","Richard Bowers",,"Pierre David, Robert Lansing Parker, Meyer Shwarzstein","David Cronenberg, Mark Sevi",1995,,1995,English,USA,Color,120,,,,,
Scanners,"Horror, Science Fiction, Thriller","Jennifer O'Neill, Stephen Lack, Patrick McGoohan","David Cronenberg","Howard Shore","Mark Irwin","Pierre David, Claude Heroux, Victor Solnicki","David Cronenberg",1981,"New World-Mutual",1981,English,Canada,Color,103,"Region 1",https://www.imdb.com/title/tt0081455/?ref_=ref_ext_clz,"After a man with extraordinary—and frighteningly destructive—telepathic abilities is nabbed by agents from a mysterious rogue corporation, he discovers he is far from the only possessor of such strange powers, and that some of the other “scanners” have their minds set on world domination, while others are trying to stop them.",6.8,"US - R"
Shivers,"Horror, Science Fiction","Paul Hampton, Joe Silver, Lynn Lowry","David Cronenberg",,"Robert Saad","Don Carmody, John Dunning, André Link","David Cronenberg",1975,"Cinépix Film Properties (CFP)",1975,English,Canada,Color,87,"Region A",https://www.imdb.com/title/tt0073705/?ref_=ref_ext_clz,"The residents of a suburban high-rise apartment building are being infected by a strain of parasites that turn them into mindless, sex-crazed fiends out to infect others by the slightest sexual contact.",6.4,"US - R"
Showgirls,Drama,"Elizabeth Berkley, Kyle MacLachlan, Gina Gershon","Paul Verhoeven","David A. Stewart","Jost Vacano","Lynn Ehrensperger, Charles Evans, Mario Kassar","Joe Eszterhas",1995,"United Artists",1995,English,France,Color,128,,https://www.imdb.com/title/tt0114436/?ref_=ref_ext_clz,"A young drifter named Nomi arrives in Las Vegas to become a dancer and soon sets about clawing and pushing her way to become a top showgirl.",4.9,"US - R"
"Six-String Samurai","Action, Adventure, Comedy, Drama, Fantasy, Music, Science Fiction","Jeffrey Falcon, Justin McGuire, Kim De Angelo","Lance Mungia","The Red Elvises, Brian Tyler","Kristian Bernier","Michael Burns, Leanna Creel, Jennifer Erwin","Jeffrey Falcon, Lance Mungia",1998,"HSX Films",1998,English,USA,Color,91,"Region Free",https://www.imdb.com/title/tt0118736/?ref_=ref_ext_clz,"In a post-apocalyptic world where the Russians have taken over a nuked USA and Elvis is king of Lost Vegas, Buddy is a '50s rocker and wandering warrior rolled into one, too-cool package. Armed with his six-string in one hand and his sword in the other, Buddy is on his way to Vegas to succeed Elvis as King. Along the way, he saves an orphan who decides to tag along.",6.6,"US - PG-13"
Slugs,Horror,"Michael Garfield, Kim Terry, Philip Machale","J.P. Simon","Tim Souster","Julio Bragado","Francesca DeLaurentiis, José Antonio Escrivá, George Ferrer","Ron Gantman, Shaun Hutson, José Antonio Escrivá",1988,"Dister Group",1988,English,Spain,Color,92,,https://www.imdb.com/title/tt0093995/?ref_=ref_ext_clz,"People are dying mysteriously and gruesomely, and nobody has a clue what the cause is. Only health worker Mike Brady has a possible solution, but his theory of killer slugs is laughed at by the authorities. Only when the body count begins to rise and a slug expert from England begins snooping around does it begin to look like Mike had the right idea after all.",5.2,"US - R"
"A Snake of June","Drama, Horror, Mystery, Thriller","Asuka Kurosawa, Yûji Kôtari, Shin'ya Tsukamoto","Shin'ya Tsukamoto","Chu Ishikawa","Shin'ya Tsukamoto","Shin'ichi Kawahara, Keiko Kusakabe, Shin'ya Tsukamoto","Shin'ya Tsukamoto",2002,"Kaijyu Theater",2002,Japanese,Japan,"Black & White",77,,https://www.imdb.com/title/tt0330904/?ref_=ref_ext_clz,"Rinku is a suicide-prevention counselor, living with her husband Shigehiko. He's older than she, scrubbing things constantly, sexually indifferent. They sleep apart. During Tokyo's rainy season, Iguchi, a photographer Rinku has counseled by phone, sends her pictures he has taken through her skylight: she's wearing a short skirt, masturbating. He offers her the negatives if she'll follow his instructions. She's humiliated and agrees. He tells her he's only giving her license to express her inner desires. He sends her into the night to walk on the wild side. Then, she asks a favor of him, and soon her husband receives phone calls and photographs. Where will this triangle lead?",6.9,"US - R"
Society,"Comedy, Horror","Billy Warlock, Concetta D'Agnese, Ben Slack","Brian Yuzna","Phil Davies, Mark Ryder","Rick Fichter","Keizo Kabata, Terry Ogisu, Keith Walley","Rick Fry, Woody Keith",1989,"Overseas FilmGroup",1989,English,Japan,Color,99,"Region B",https://www.imdb.com/title/tt0098354/?ref_=ref_ext_clz,"A Beverly Hills teen (Billy Warlock) discovers his parents are part of a gruesome orgy cult for the social elite.",6.5,"US - R"
"Soldier of Orange","Drama, Romance, Thriller, War","Rutger Hauer, Jeroen Krabbé, Susan Penhaligon","Paul Verhoeven","Rogier van OTTERLOO","Jost Vacano","Rob Houwer","Erik Hazelhoff Roelfzema, Kees Holierhoek, Gerard Soeteman",1977,"Tuschinski Film Distribution",1977,Dutch,Belgium,Color,155,,https://www.imdb.com/title/tt0076734/?ref_=ref_ext_clz,"The lives of Erik Lanshof and five of his closest friends take different paths when the German army invades the Netherlands in 1940: fight and resistance, fear and resignation, collaboration and high treason.",7.7,"US - R"
Spetters,"Drama, Romance, Sports","Hans van Tongeren, Renée Soutendijk, Toon Agterberg","Paul Verhoeven","Ton Scherpenzeel","Jost Vacano","Joop van den Ende","Gerard Soeteman, Jan Wolkers",1980,"VSE Film",1980,Dutch,"The Netherlands",Color,120,"Region A",https://www.imdb.com/title/tt0081547/?ref_=ref_ext_clz,"A Dutch film, post-Saturday Night Fever, which follows the lives of three young men who are amateur dirt-bike motorcycle racers. They each fall in love with a young woman who, with her brother, sells French fries and hot dogs at the races. Everyone is looking for a better life. She wants out of the business and away from her brother. The motocross racers want to make their marks as professional racers, like their hero, played by Rutger Hauer.",6.6,"US - R"
Spookies,"Comedy, Horror","Felix Ward, Maria Pechukas, Dan Scott","Eugenie Joseph, Thomas Doran, Brendan Faulkner","James Calabrese, Kenneth Higgins","Robert Chappell, Ken Kelsch","Thomas Doran, Frank M. Farel, Brendan Faulkner","Ann Burgund, Thomas Doran, Frank M. Farel",1986,,1986,English,USA,Color,85,"Region A, Region B, Region C",https://www.imdb.com/title/tt0090057/?ref_=ref_ext_clz,"Taking a wrong turn, travelers find themselves trapped in a mysterious house. One horror after another threatens them as the sorcerer who lives within needs sacrifices to give eternal life to his beautiful bride.",5,"US - R"
"Starship Troopers","Action, Adventure, Science Fiction, Thriller","Casper Van Dien, Dina Meyer, Denise Richards","Paul Verhoeven","Basil Poledouris","Jost Vacano","Jon Davison, Frances Doel, Stacy Lumbrezer","Edward Neumeier, Robert A. Heinlein",1997,"Buena Vista International",1997,English,USA,Color,129,"Region A, Region B, Region C",https://www.imdb.com/title/tt0120201/?ref_=ref_ext_clz,"Set in the future, the story follows a young soldier named Johnny Rico and his exploits in the Mobile Infantry. Rico's military career progresses from recruit to non-commissioned officer and finally to officer against the backdrop of an interstellar war between mankind and an arachnoid species known as ""the Bugs"".",7.2,"US - R"
